{
  "$schema": "./guideline-manifest.schema.json",
  "schema_version": 1,
  "title": "New Project Guideline",
  "entry_path": "docs/guidelines/README.md",
  "entry_template_path": "docs/guidelines/entry-template.md",
  "agent_instructions_template_path": "docs/guidelines/AGENTS.template.md",
  "semantic_baseline": {
    "sha256": "7d48465a7dbbe00b83a51d6b0d3d9fc322e578f00c4fa6bb206fdfb33f5c4931",
    "bytes": 602790,
    "lines": 10359,
    "meaning": "Doxanh 5.0.1 retains the 5.0.0 composition and readability contracts and clarifies bounded shared-region evidence in GDL-080: each source root requires matching coverage, and dialog evidence cannot certify an unrelated page or full review. Semantic diff reviewed 2026-09-14; user approved the focused correction and release."
  },
  "profiles": {
    "required": [
      "shared"
    ],
    "optional": [
      "nuxt-web",
      "nuxt-api",
      "flutter-native"
    ]
  },
  "capabilities": [
    "commercial-access",
    "shareable-entry",
    "payments",
    "printing",
    "cache",
    "queue",
    "scheduler",
    "realtime",
    "files"
  ],
  "capability_dependencies": {
    "scheduler": [
      "queue"
    ]
  },
  "task_reading": {
    "ui_required": ["UI-VISUAL-001", "UI-DENSITY-001", "UI-RESP-001", "UI-ACTION-001", "UI-COPY-001", "UI-CONTROL-001", "UI-STATE-001", "UI-ACCESS-001"],
    "always": [
      "GDL-000",
      "GDL-080"
    ],
    "dependencies": {
      "GDL-065": [
        "GDL-064"
      ],
      "GDL-066": [
        "GDL-064"
      ]
    },
    "rules": {
      "VERIFY-SCOPE-001": [
        "GDL-080"
      ],
      "VERIFY-CLAIM-001": [
        "GDL-080"
      ],
      "DOC-BOOK-001": [
        "GDL-020",
        "GDL-021",
        "GDL-025"
      ],
      "DATA-DOC-001": [
        "GDL-024",
        "GDL-025"
      ],
      "UI-VISUAL-001": [],
      "UI-DENSITY-001": [],
      "UI-AUDIENCE-001": [],
      "UI-ACTION-001": [],
      "UI-COPY-001": [],
      "UI-CONTROL-001": [],
      "UI-COLLECTION-001": [],
      "UI-RESP-001": [],
      "UI-STATE-001": [],
      "UI-ACCESS-001": [],
      "TIME-PRESENTATION-001": [],
      "DATA-CONCURRENCY-001": [],
      "DATA-REFERENCE-001": [],
      "AUTH-SESSION-001": [
        "GDL-070"
      ],
      "ENTRY-SHARE-001": [
        "GDL-041"
      ],
      "COMMERCIAL-001": [
        "GDL-022"
      ]
    },
    "profile_rules": {
      "nuxt-web": {
        "UI-VISUAL-001": [
          "GDL-050",
          "GDL-052"
        ],
        "UI-DENSITY-001": [
          "GDL-023",
          "GDL-050",
          "GDL-051",
          "GDL-052"
        ],
        "UI-AUDIENCE-001": [
          "GDL-051",
          "GDL-052",
          "GDL-070"
        ],
        "UI-ACTION-001": [
          "GDL-030",
          "GDL-051",
          "GDL-052"
        ],
        "UI-COPY-001": [
          "GDL-021",
          "GDL-052"
        ],
        "UI-CONTROL-001": [
          "GDL-052"
        ],
        "UI-COLLECTION-001": [
          "GDL-051"
        ],
        "UI-RESP-001": [
          "GDL-051",
          "GDL-052"
        ],
        "UI-STATE-001": [
          "GDL-051",
          "GDL-052"
        ],
        "UI-ACCESS-001": [
          "GDL-052"
        ],
        "TIME-PRESENTATION-001": [
          "GDL-042"
        ],
        "DATA-CONCURRENCY-001": [
          "GDL-051",
          "GDL-052",
          "GDL-060"
        ],
        "DATA-REFERENCE-001": [
          "GDL-051",
          "GDL-052",
          "GDL-060"
        ]
      },
      "nuxt-api": {
        "TIME-PRESENTATION-001": [
          "GDL-042",
          "GDL-060"
        ],
        "DATA-CONCURRENCY-001": [
          "GDL-063",
          "GDL-071"
        ],
        "DATA-REFERENCE-001": [
          "GDL-063",
          "GDL-071"
        ]
      },
      "flutter-native": {
        "UI-VISUAL-001": [
          "GDL-053"
        ],
        "UI-DENSITY-001": [
          "GDL-053"
        ],
        "UI-AUDIENCE-001": [
          "GDL-070",
          "GDL-053"
        ],
        "UI-ACTION-001": [
          "GDL-030",
          "GDL-053"
        ],
        "UI-COPY-001": [
          "GDL-021",
          "GDL-053"
        ],
        "UI-CONTROL-001": [
          "GDL-053"
        ],
        "UI-COLLECTION-001": [
          "GDL-053"
        ],
        "UI-RESP-001": [
          "GDL-053"
        ],
        "UI-STATE-001": [
          "GDL-053"
        ],
        "UI-ACCESS-001": [
          "GDL-053"
        ],
        "TIME-PRESENTATION-001": [
          "GDL-053",
          "GDL-060"
        ],
        "DATA-CONCURRENCY-001": [
          "GDL-053",
          "GDL-060"
        ],
        "DATA-REFERENCE-001": [
          "GDL-053",
          "GDL-060"
        ]
      }
    }
  },
  "critical_contracts": {
    "project_book_documentation": {
      "rule_id": "DOC-BOOK-001",
      "manifest_driven": true,
      "minimum_content_enforced": true,
      "complete_state_transition_coverage": true,
      "traceability_required": true
    },
    "database_documentation": {
      "rule_id": "DATA-DOC-001",
      "canonical_schema_reconciliation": true,
      "all_tables_and_columns": true,
      "per_table_behavior_contract": true,
      "executable_data_check": true
    },
    "api_response_envelope": {
      "top_level_fields": [
        "success",
        "code",
        "message",
        "data",
        "request_id"
      ],
      "endpoint_specific_field": "data",
      "success_code": 0,
      "handled_http_status": 200,
      "unexpected_http_status": 500,
      "extra_top_level_fields": "forbidden"
    },
    "ui_choice_controls": {
      "rule_id": "UI-CONTROL-001",
      "select_max_options": 9,
      "combobox_min_options": 10,
      "combobox_for_remote_catalogs": true,
      "combobox_for_name_or_code_lookup": true
    },
    "ui_copy": {
      "rule_id": "UI-COPY-001",
      "implementation_details_forbidden": true,
      "policy_narration_forbidden_by_default": true,
      "complete_rendered_copy_review": true,
      "canonical_actor_scope_vocabulary": true,
      "raw_or_humanized_technical_keys_forbidden": true,
      "competing_synonyms_rejected": true
    },
    "ui_density": {
      "rule_id": "UI-DENSITY-001",
      "default_density": "compact",
      "phone_touch_target_min_css_px": 44,
      "adjacent_target_separation_min_css_px": 8,
      "desktop_action_width": "natural",
      "composition_contract_required": true,
      "rendered_and_visual_evidence_required": true
    },
    "ui_audience_projection": {
      "rule_id": "UI-AUDIENCE-001",
      "server_authoritative": true,
      "complete_observable_surface": true,
      "shared_components_permission_neutral": true,
      "filter_options_from_authorized_scope": true,
      "counts_and_facets_scope_projected": true,
      "cross_boundary_identity_default": "redacted",
      "direct_request_no_leak_tests": true
    },
    "verification_scope": {
      "rule_id": "VERIFY-SCOPE-001",
      "default_mode": "risk-scoped",
      "safe_fallback_requires_review": true,
      "unrelated_suites_forbidden": true,
      "changed_evidence_binding": "maintained-content-fingerprint",
      "commit_only_transition_preserves_evidence": true,
      "full_release_revision_binding_strict": true,
      "source_change_scope": "changed-module-boundaries-and-direct-consumers",
      "source_change_forces_full_regression": false,
      "multi_module_scope": "union-of-focused-slices",
      "release_scope": "candidate-diff-plus-universal-release-baseline",
      "release_candidate_forces_full_regression": false,
      "release_base_revision_required": true,
      "release_target_environment_required": true,
      "release_predeployment_baseline_required": true,
      "release_postdeployment_baseline_required": true,
      "release_unrelated_suites_forbidden": true,
      "full_regression_triggers": [
        "explicit-request",
        "initial-release-or-missing-baseline",
        "cross-cutting-change",
        "systemic-evidence",
        "unbounded-impact"
      ]
    },
    "verification_claim": {
      "rule_id": "VERIFY-CLAIM-001",
      "claim_unit": "declared-finite-scope",
      "binary_lead_required": true,
      "absolute_zero_defect_claim_forbidden": true,
      "scope_complete_requires_zero_open_boundaries": true,
      "incomplete_claim": "not_verified"
    }
  },
  "modules": [
    {
      "id": "GDL-000",
      "path": "docs/guidelines/modules/00-authority-and-principles.md",
      "title": "Authority and principles",
      "activation": {
        "kind": "always",
        "values": []
      },
      "start_marker": null,
      "end_before": "## 3. Approved technology baseline"
    },
    {
      "id": "GDL-010",
      "path": "docs/guidelines/modules/10-approved-stack.md",
      "title": "Approved technology baseline",
      "activation": {
        "kind": "always",
        "values": []
      },
      "start_marker": "## 3. Approved technology baseline",
      "end_before": "## 4. Project book and document-generation system"
    },
    {
      "id": "GDL-020",
      "path": "docs/guidelines/modules/20-project-book-system.md",
      "title": "Project-book system",
      "activation": {
        "kind": "always",
        "values": []
      },
      "start_marker": "## 4. Project book and document-generation system",
      "end_before": "### 4.7 Minimum content contracts: orientation and product"
    },
    {
      "id": "GDL-021",
      "path": "docs/guidelines/modules/21-product-document-contracts.md",
      "title": "Product document contracts",
      "activation": {
        "kind": "always",
        "values": []
      },
      "start_marker": "### 4.7 Minimum content contracts: orientation and product",
      "end_before": "When pricing, trials, plans, feature entitlements, quotas, seats, devices, or"
    },
    {
      "id": "GDL-022",
      "path": "docs/guidelines/modules/22-commercial-access-capability.md",
      "title": "Commercial-access capability",
      "activation": {